{
  "schema": "ucc.result",
  "schema_version": 1,
  "result_id": "res_01K0A6R4V8W6E3M4M8Y0R9J2QX",
  "request_id": "req_01K0A6R4V8W6E3M4M8Y0R9J2QX",
  "operation_id": "op_01K0A6R4V8W6E3M4M8Y0R9J2QX",
  "correlation_id": "corr_01K0A6R4V8W6E3M4M8Y0R9J2QX",
  "completed_at": "2026-07-12T12:00:00.000Z",
  "disposition": "completed",
  "resource": {
    "kind": "execution",
    "id": "exec_01K0A6R4V8W6E3M4M8Y0R9J2QX"
  },
  "warnings": []
}
